{
  "pact": "0.3",
  "type": "Verdict",
  "vtc_id": "vtc_9f2c11",
  "delivery_hash": "sha256:dfabe6a5d1aaf23868dec65e1517dc0dfa911b41054ea10d641bb919aed34c95",
  "challenge_hash": "sha256:298494c02feb0a51def024b5e22acf11aa65d0f4e175271f07962215f26e71a9",
  "outcome": "FAIL",
  "profile": "acceptance",
  "instrument_hash": "sha256:0bdde1ab6b081d2b4bda580c5393756ae95c10b8351c9c55eb9316416265fc1b",
  "results_hash": "sha256:7f05a60223e24ca9393e0c241d0448cb5f39e5edb71c117fb7d3d593d5861b40",
  "evaluated_at": "2026-11-10T09:57:40Z",
  "signature": {
    "protected": "eyJhbGciOiJFZDI1NTE5Iiwia2lkIjoiZGlkOndlYjphdWRpdC5leGFtcGxlI2sxIiwidHlwIjoiYXBwbGljYXRpb24vdm5kLnBhY3QudmVyZGljdCtqc29uIn0",
    "signature": "8X4jTzCBOGZ0rKbAGfs_ymAeyIYk9WIX6bACZL3Pnp8jMHcCcOKB-sbg2ItFEwu9nmyvbYGy6X3z9-T0rcgWBw"
  }
}
