{
  "pact": "0.3",
  "type": "Verdict",
  "vtc_id": "vtc_9f2c11",
  "delivery_hash": "sha256:dfabe6a5d1aaf23868dec65e1517dc0dfa911b41054ea10d641bb919aed34c95",
  "outcome": "PASS",
  "profile": "acceptance",
  "instrument_hash": "sha256:0bdde1ab6b081d2b4bda580c5393756ae95c10b8351c9c55eb9316416265fc1b",
  "results_hash": "sha256:28d334e0e0e0771eb5708452612ebcc6fbf848ebaca540214b4f6d2165688a51",
  "evaluated_at": "2026-11-10T09:14:22Z",
  "signature": {
    "protected": "eyJhbGciOiJFZDI1NTE5Iiwia2lkIjoiZGlkOndlYjphdWRpdC5leGFtcGxlI2sxIiwidHlwIjoiYXBwbGljYXRpb24vdm5kLnBhY3QudmVyZGljdCtqc29uIn0",
    "signature": "v1VbFoxSQtHVXwgQFJKoQpqp4KSkSa8zYTXGtTnsnS54xwvUfgOf6JmgfvNmKdjwqcK3PhKp9Wo4AROgrmPJBw"
  }
}
